REF_DATE,GEO,DGUID,"Census metropolitan areas and census agglomerations, by population centres and rural areas (718)",Coordinate,"Population and land area (2): Population, 2021 [1]",Symbols,"Population and land area (2): Land area in square kilometres, 2021 [2]",Symbols
2021,Canada,2021A000011124,"Abbotsford - Mission, British Columbia (CMA)",1.1,195726,,606.72,
2021,Canada,2021A000011124,Abbotsford (Large urban population centre),1.2,132300,,71.2,
2021,Canada,2021A000011124,Mission (Medium population centre),1.3,36193,,27.23,
2021,Canada,2021A000011124,Aldergrove East (Small population centre),1.4,4496,,2.55,
2021,Canada,2021A000011124,Rural area,1.5,22737,,505.74,
2021,Canada,2021A000011124,"Alma, Quebec (CA)",1.6,30331,,194.92,
2021,Canada,2021A000011124,Alma (Small population centre),1.7,20274,,15.94,
2021,Canada,2021A000011124,Rural area,1.8,10057,,178.99,
2021,Canada,2021A000011124,"Amos, Quebec (CA)",1.9,18873,,2298.16,
2021,Canada,2021A000011124,Amos (Small population centre),1.1,9281,,8.43,
2021,Canada,2021A000011124,Rural area,1.11,9592,,2289.73,
2021,Canada,2021A000011124,"Baie-Comeau, Quebec (CA)",1.12,26643,,682.89,
2021,Canada,2021A000011124,Baie-Comeau (Small population centre),1.13,9100,,11.28,
2021,Canada,2021A000011124,Hauterive (Small population centre),1.14,11147,,8.67,
2021,Canada,2021A000011124,Rural area,1.15,6396,,662.94,
2021,Canada,2021A000011124,"Barrie, Ontario (CMA)",1.16,212856,,897.26,
2021,Canada,2021A000011124,Barrie (Large urban population centre),1.17,154676,,95.33,
2021,Canada,2021A000011124,Big Bay Point (Small population centre),1.18,1670,,2.63,
2021,Canada,2021A000011124,Cookstown (Small population centre),1.19,1647,,1.14,
2021,Canada,2021A000011124,Elmvale (Small population centre),1.2,2520,,1.98,
2021,Canada,2021A000011124,Innisfil (Small population centre),1.21,29464,,23.71,
2021,Canada,2021A000011124,Rural area,1.22,22879,,772.47,
2021,Canada,2021A000011124,"Bathurst, New Brunswick (CA)",1.23,31387,,2100.05,
2021,Canada,2021A000011124,Bathurst (Small population centre),1.24,15985,,27.92,
2021,Canada,2021A000011124,Rural area,1.25,15402,,2072.13,
2021,Canada,2021A000011124,"Belleville - Quinte West, Ontario (CMA)",1.26,111184,,1337.5,
2021,Canada,2021A000011124,Belleville (Medium population centre),1.27,75052,,89.48,
2021,Canada,2021A000011124,Frankford (Small population centre),1.28,3079,,2.91,
2021,Canada,2021A000011124,Stirling (Small population centre),1.29,2074,,3.03,
2021,Canada,2021A000011124,Rural area,1.3,30979,,1242.07,
2021,Canada,2021A000011124,"Brandon, Manitoba (CA)",1.31,54268,,1232.81,
2021,Canada,2021A000011124,Brandon (Medium population centre),1.32,50532,,28.73,
2021,Canada,2021A000011124,Rural area,1.33,3736,,1204.09,
2021,Canada,2021A000011124,"Brantford, Ontario (CMA)",1.34,144162,,1074,
2021,Canada,2021A000011124,Brantford (Large urban population centre),1.35,104413,,62.13,
2021,Canada,2021A000011124,Burford (Small population centre),1.36,1058,,2.01,
2021,Canada,2021A000011124,Paris (Small population centre),1.37,14956,,13.55,
2021,Canada,2021A000011124,St. George (Small population centre),1.38,3354,,2.97,
2021,Canada,2021A000011124,Rural area,1.39,20381,,993.34,
2021,Canada,2021A000011124,"Brockville, Ontario (CA)",1.4,31661,,576.87,
2021,Canada,2021A000011124,Brockville (Small population centre),1.41,22293,,18.7,
2021,Canada,2021A000011124,Rural area,1.42,9368,,558.17,
2021,Canada,2021A000011124,"Brooks, Alberta (CA)",1.43,14924,,18.21,
2021,Canada,2021A000011124,Brooks (Small population centre),1.44,14904,,12.78,
2021,Canada,2021A000011124,Rural area,1.45,20,,5.43,
2021,Canada,2021A000011124,"Calgary, Alberta (CMA)",1.46,1481806,,5098.68,
2021,Canada,2021A000011124,Calgary (Large urban population centre),1.47,1305550,,621.72,
2021,Canada,2021A000011124,Airdrie (Medium population centre),1.48,73578,,33.03,
2021,Canada,2021A000011124,Cochrane (Medium population centre),1.49,31638,,23.71,
2021,Canada,2021A000011124,Chestermere (Small population centre),1.5,21425,,8.99,
2021,Canada,2021A000011124,Crossfield (Small population centre),1.51,3579,,3.99,
2021,Canada,2021A000011124,Irricana (Small population centre),1.52,1135,,1.14,
2021,Canada,2021A000011124,Langdon (Small population centre),1.53,5193,,4.32,
2021,Canada,2021A000011124,Rural area,1.54,39708,,4401.78,
2021,Canada,2021A000011124,"Campbell River, British Columbia (CA)",1.55,40704,,1734.05,
2021,Canada,2021A000011124,Campbell River (Medium population centre),1.56,38108,,33,
2021,Canada,2021A000011124,Rural area,1.57,2596,,1701.05,
2021,Canada,2021A000011124,"Campbellton, New Brunswick/Quebec (CA)",1.58,13330,,1525.45,
2021,Canada,2021A000011124,Campbellton (Small population centre),1.59,8833,,17.8,
2021,Canada,2021A000011124,Rural area,1.6,4497,,1507.65,
2021,Canada,2021A000011124,"Camrose, Alberta (CA)",1.61,18772,,41.67,
2021,Canada,2021A000011124,Camrose (Small population centre),1.62,18454,,17.1,
2021,Canada,2021A000011124,Rural area,1.63,318,,24.57,
2021,Canada,2021A000011124,"Canmore, Alberta (CA)",1.64,15990,,68.47,
2021,Canada,2021A000011124,Canmore (Small population centre),1.65,13268,,12.96,
2021,Canada,2021A000011124,Rural area,1.66,2722,,55.51,
2021,Canada,2021A000011124,"Cape Breton, Nova Scotia (CA)",1.67,98318,,2457.21,
2021,Canada,2021A000011124,Cape Breton - Sydney (Medium population centre),1.68,30960,,30.91,
2021,Canada,2021A000011124,Eskasoni 3 (Small population centre),1.69,2575,,5.7,
2021,Canada,2021A000011124,Glace Bay (Small population centre),1.7,16915,,31.19,
2021,Canada,2021A000011124,Howie Centre (Small population centre),1.71,1106,,1.67,
2021,Canada,2021A000011124,New Waterford (Small population centre),1.72,6723,,9.23,
2021,Canada,2021A000011124,Sydney Mines (Small population centre),1.73,12353,,18.11,
2021,Canada,2021A000011124,Rural area,1.74,27686,,2360.4,
2021,Canada,2021A000011124,"Centre Wellington, Ontario (CA)",1.75,31093,,409.41,
2021,Canada,2021A000011124,Fergus (Small population centre),1.76,23209,,18.31,
2021,Canada,2021A000011124,Rural area,1.77,7884,,391.1,
2021,Canada,2021A000011124,"Charlottetown, Prince Edward Island (CA)",1.78,78858,,1112.43,
2021,Canada,2021A000011124,Charlottetown (Medium population centre),1.79,52390,,57.56,
2021,Canada,2021A000011124,Rural area,1.8,26468,,1054.87,
2021,Canada,2021A000011124,"Chatham-Kent, Ontario (CA)",1.81,104316,,2464.52,
2021,Canada,2021A000011124,Chatham (Medium population centre),1.82,45171,,31.21,
2021,Canada,2021A000011124,Blenheim (Small population centre),1.83,4487,,4.6,
2021,Canada,2021A000011124,Dresden (Small population centre),1.84,2401,,2.78,
2021,Canada,2021A000011124,Ridgetown (Small population centre),1.85,2797,,2.73,
2021,Canada,2021A000011124,Tilbury (Small population centre),1.86,4687,,4.14,
2021,Canada,2021A000011124,Wallaceburg (Small population centre),1.87,10323,,8.84,
2021,Canada,2021A000011124,Wheatley (Small population centre),1.88,3060,,3.4,
2021,Canada,2021A000011124,Rural area,1.89,31390,,2406.81,
2021,Canada,2021A000011124,"Chilliwack, British Columbia (CMA)",1.9,113767,,1444.02,
2021,Canada,2021A000011124,Chilliwack (Medium population centre),1.91,81622,,56.02,
2021,Canada,2021A000011124,Cultus Lake (Small population centre),1.92,1164,,1.8,
2021,Canada,2021A000011124,Harrison Hot Springs (Small population centre),1.93,1552,,1.17,
2021,Canada,2021A000011124,Kent (Small population centre),1.94,3936,,4.02,
2021,Canada,2021A000011124,Rosedale (Small population centre),1.95,2232,,4.39,
2021,Canada,2021A000011124,Yarrow (Small population centre),1.96,1378,,3.37,
2021,Canada,2021A000011124,Rural area,1.97,21883,,1373.25,
2021,Canada,2021A000011124,"Cobourg, Ontario (CA)",1.98,20519,,22.41,
2021,Canada,2021A000011124,Cobourg (Small population centre),1.99,19830,,15.57,
2021,Canada,2021A000011124,Rural area,1.1,689,,6.83,
2021,Canada,2021A000011124,"Collingwood, Ontario (CA)",1.101,24811,,33.15,
2021,Canada,2021A000011124,Collingwood (Small population centre),1.102,22983,,16.38,
2021,Canada,2021A000011124,Rural area,1.103,1828,,16.77,
2021,Canada,2021A000011124,"Corner Brook, Newfoundland and Labrador (CA)",1.104,29762,,1122.58,
2021,Canada,2021A000011124,Corner Brook (Small population centre),1.105,19129,,21.6,
2021,Canada,2021A000011124,Massey Drive (Small population centre),1.106,1606,,2.45,
2021,Canada,2021A000011124,Pasadena (Small population centre),1.107,2769,,3.54,
2021,Canada,2021A000011124,Rural area,1.108,6258,,1094.98,
2021,Canada,2021A000011124,"Cornwall, Ontario (CA)",1.109,61415,,509.21,
2021,Canada,2021A000011124,Cornwall (Medium population centre),1.11,47286,,32.4,
2021,Canada,2021A000011124,Ingleside (Small population centre),1.111,1487,,1.76,
2021,Canada,2021A000011124,Long Sault (Small population centre),1.112,2154,,2.35,
2021,Canada,2021A000011124,Rural area,1.113,10488,,472.71,
2021,Canada,2021A000011124,"Courtenay, British Columbia (CA)",1.114,63282,,624.33,
2021,Canada,2021A000011124,Courtenay (Medium population centre),1.115,48917,,56.58,
2021,Canada,2021A000011124,Cumberland (Small population centre),1.116,4190,,3.91,
2021,Canada,2021A000011124,Rural area,1.117,10175,,563.84,
2021,Canada,2021A000011124,"Cowansville, Quebec (CA)",1.118,15234,,46.87,
2021,Canada,2021A000011124,Cowansville (Small population centre),1.119,13334,,16.35,
2021,Canada,2021A000011124,Rural area,1.12,1900,,30.52,
2021,Canada,2021A000011124,"Cranbrook, British Columbia (CA)",1.121,27040,,4563.87,
2021,Canada,2021A000011124,Cranbrook (Small population centre),1.122,20008,,16.32,
2021,Canada,2021A000011124,Rural area,1.123,7032,,4547.55,
2021,Canada,2021A000011124,"Dawson Creek, British Columbia (CA)",1.124,17878,,11716.8,
2021,Canada,2021A000011124,Dawson Creek (Small population centre),1.125,11706,,12.34,
2021,Canada,2021A000011124,Rural area,1.126,6172,,11704.45,
2021,Canada,2021A000011124,"Dolbeau-Mistassini, Quebec (CA)",1.127,15306,,647.75,
2021,Canada,2021A000011124,Dolbeau (Small population centre),1.128,10849,,10.49,
2021,Canada,2021A000011124,Rural area,1.129,4457,,637.27,
2021,Canada,2021A000011124,"Drummondville, Quebec (CMA)",1.13,101610,,1094.36,
2021,Canada,2021A000011124,Drummondville (Medium population centre),1.131,72089,,52.3,
2021,Canada,2021A000011124,Notre-Dame-du-Bon-Conseil (Small population centre),1.132,1149,,1.39,
2021,Canada,2021A000011124,Saint-Cyrille-de-Wendover (Small population centre),1.133,1315,,0.94,
2021,Canada,2021A000011124,Saint-Germain-de-Grantham (Small population centre),1.134,3436,,2.66,
2021,Canada,2021A000011124,Rural area,1.135,23621,,1037.07,
2021,Canada,2021A000011124,"Duncan, British Columbia (CA)",1.136,47582,,373.22,
2021,Canada,2021A000011124,Chemainus (Small population centre),1.137,4033,,5.82,
2021,Canada,2021A000011124,Cowichan Bay (Small population centre),1.138,2799,,4.47,
2021,Canada,2021A000011124,Crofton (Small population centre),1.139,1446,,2.76,
2021,Canada,2021A000011124,Duncan (Small population centre),1.14,24358,,22.75,
2021,Canada,2021A000011124,Rural area,1.141,14946,,337.42,
2021,Canada,2021A000011124,"Edmonton, Alberta (CMA)",1.142,1418118,,9416.19,
2021,Canada,2021A000011124,Edmonton (Large urban population centre),1.143,1151635,,627.2,
2021,Canada,2021A000011124,Leduc (Medium population centre),1.144,33505,,67.43,
2021,Canada,2021A000011124,Spruce Grove (Medium population centre),1.145,39348,,29.76,
2021,Canada,2021A000011124,Beaumont (Small population centre),1.146,20779,,10.4,
2021,Canada,2021A000011124,Bon Accord (Small population centre),1.147,1451,,2.13,
2021,Canada,2021A000011124,Calmar (Small population centre),1.148,1883,,1.33,
2021,Canada,2021A000011124,Cardiff (Small population centre),1.149,1033,,0.98,
2021,Canada,2021A000011124,Devon (Small population centre),1.15,6545,,14.26,
2021,Canada,2021A000011124,Fort Saskatchewan (Small population centre),1.151,26831,,21.85,
2021,Canada,2021A000011124,Gibbons (Small population centre),1.152,2989,,4.78,
2021,Canada,2021A000011124,Lancaster Park (Small population centre),1.153,1253,,0.92,
2021,Canada,2021A000011124,Legal (Small population centre),1.154,1164,,1.79,
2021,Canada,2021A000011124,Morinville (Small population centre),1.155,10385,,11.15,
2021,Canada,2021A000011124,Redwater (Small population centre),1.156,1802,,2.01,
2021,Canada,2021A000011124,Stony Plain (Small population centre),1.157,17253,,17.73,
2021,Canada,2021A000011124,Rural area,1.158,100262,,8602.5,
2021,Canada,2021A000011124,"Edmundston, New Brunswick (CA)",1.159,22144,,1582.36,
2021,Canada,2021A000011124,Edmundston (Small population centre),1.16,13125,,19.06,
2021,Canada,2021A000011124,Rural area,1.161,9019,,1563.3,
2021,Canada,2021A000011124,"Elliot Lake, Ontario (CA)",1.162,11372,,696.06,
2021,Canada,2021A000011124,Elliot Lake (Small population centre),1.163,10998,,10.27,
2021,Canada,2021A000011124,Rural area,1.164,374,,685.79,
2021,Canada,2021A000011124,"Essa, Ontario (CA)",1.165,22970,,279.92,
2021,Canada,2021A000011124,Angus - Borden CFB-BFC (Small population centre),1.166,14503,,14.19,
2021,Canada,2021A000011124,Thornton (Small population centre),1.167,1046,,1.11,
2021,Canada,2021A000011124,Rural area,1.168,7421,,264.62,
2021,Canada,2021A000011124,"Estevan, Saskatchewan (CA)",1.169,12798,,793.36,
2021,Canada,2021A000011124,Estevan (Small population centre),1.17,10629,,9.43,
2021,Canada,2021A000011124,Rural area,1.171,2169,,783.93,
2021,Canada,2021A000011124,"Fort St. John, British Columbia (CA)",1.172,28729,,617.73,
2021,Canada,2021A000011124,Fort St. John (Small population centre),1.173,21123,,14.89,
2021,Canada,2021A000011124,Rural area,1.174,7606,,602.85,
2021,Canada,2021A000011124,"Fredericton, New Brunswick (CMA)",1.175,108610,,6014.66,
2021,Canada,2021A000011124,Fredericton (Medium population centre),1.176,64614,,89.6,
2021,Canada,2021A000011124,New Maryland (Small population centre),1.177,2179,,2.7,
2021,Canada,2021A000011124,Starlight Village (Small population centre),1.178,2222,,5.27,
2021,Canada,2021A000011124,Rural area,1.179,39595,,5917.08,
2021,Canada,2021A000011124,"Gander, Newfoundland and Labrador (CA)",1.18,13414,,2412.67,
2021,Canada,2021A000011124,Gander (Small population centre),1.181,9918,,13.64,
2021,Canada,2021A000011124,Rural area,1.182,3496,,2399.03,
2021,Canada,2021A000011124,"Granby, Quebec (CA)",1.183,90833,,494.1,
2021,Canada,2021A000011124,Granby (Medium population centre),1.184,62624,,48.39,
2021,Canada,2021A000011124,Bromont (Small population centre),1.185,5345,,7.92,
2021,Canada,2021A000011124,LeBlanc (Small population centre),1.186,1186,,1.69,
2021,Canada,2021A000011124,Roxton Pond (Small population centre),1.187,2701,,3.28,
2021,Canada,2021A000011124,Rural area,1.188,18977,,432.81,
2021,Canada,2021A000011124,"Grand Falls-Windsor, Newfoundland and Labrador (CA)",1.189,13853,,54.84,
2021,Canada,2021A000011124,Grand Falls-Windsor (Small population centre),1.19,11986,,12.34,
2021,Canada,2021A000011124,Rural area,1.191,1867,,42.5,
2021,Canada,2021A000011124,"Grande Prairie, Alberta (CA)",1.192,64141,,132.71,
2021,Canada,2021A000011124,Grande Prairie (Medium population centre),1.193,63172,,49.74,
2021,Canada,2021A000011124,Rural area,1.194,969,,82.97,
2021,Canada,2021A000011124,"Greater Sudbury / Grand Sudbury, Ontario (CMA)",1.195,170605,,4187.4,
2021,Canada,2021A000011124,Sudbury (Medium population centre),1.196,92093,,75.79,
2021,Canada,2021A000011124,Azilda (Small population centre),1.197,4793,,4.91,
2021,Canada,2021A000011124,Capreol (Small population centre),1.198,2919,,2.26,
2021,Canada,2021A000011124,Chelmsford (Small population centre),1.199,6199,,5.5,
2021,Canada,2021A000011124,Coniston (Small population centre),1.2,1782,,2.25,
2021,Canada,2021A000011124,Dowling (Small population centre),1.201,1449,,1.35,
2021,Canada,2021A000011124,Lively (Small population centre),1.202,5569,,11.67,
2021,Canada,2021A000011124,Valley East (Small population centre),1.203,17251,,25.82,
2021,Canada,2021A000011124,Rural area,1.204,38550,,4057.85,
2021,Canada,2021A000011124,"Guelph, Ontario (CMA)",1.205,165588,,595.08,
2021,Canada,2021A000011124,Guelph (Large urban population centre),1.206,144356,,79.57,
2021,Canada,2021A000011124,Rockwood (Small population centre),1.207,5488,,5.92,
2021,Canada,2021A000011124,Rural area,1.208,15744,,509.59,
2021,Canada,2021A000011124,"Halifax, Nova Scotia (CMA)",1.209,465703,,7276.22,
2021,Canada,2021A000011124,Halifax (Large urban population centre),1.21,348634,,238.29,
2021,Canada,2021A000011124,Brookside (Small population centre),1.211,1439,,2.81,
2021,Canada,2021A000011124,Enfield - Lantz (Small population centre),1.212,6583,,11.67,
2021,Canada,2021A000011124,Indian Brook 14 (Small population centre),1.213,2332,,3.89,
2021,Canada,2021A000011124,Lake Echo (Small population centre),1.214,2365,,4.76,
2021,Canada,2021A000011124,Still Water Lake (Small population centre),1.215,3379,,8.23,
2021,Canada,2021A000011124,Rural area,1.216,100971,,7006.56,
2021,Canada,2021A000011124,"Hamilton, Ontario (CMA)",1.217,785184,,1373.15,
2021,Canada,2021A000011124,Hamilton (Large urban population centre),1.218,729560,,356.03,
2021,Canada,2021A000011124,Binbrook (Small population centre),1.219,10791,,6.41,
2021,Canada,2021A000011124,Carlisle (Small population centre),1.22,1858,,2.56,
2021,Canada,2021A000011124,Rural area,1.221,42975,,1008.15,
2021,Canada,2021A000011124,"Hawkesbury, Ontario/Quebec (CA)",1.222,12010,,12.91,
2021,Canada,2021A000011124,Hawkesbury (Small population centre),1.223,11755,,10.82,
2021,Canada,2021A000011124,Rural area,1.224,255,,2.09,
2021,Canada,2021A000011124,"High River, Alberta (CA)",1.225,14324,,22.19,
2021,Canada,2021A000011124,High River (Small population centre),1.226,14119,,10.13,
2021,Canada,2021A000011124,Rural area,1.227,205,,12.07,
2021,Canada,2021A000011124,"Ingersoll, Ontario (CA)",1.228,13693,,12.73,
2021,Canada,2021A000011124,Ingersoll (Small population centre),1.229,13607,,10.32,
2021,Canada,2021A000011124,Rural area,1.23,86,,2.42,
2021,Canada,2021A000011124,"Joliette, Quebec (CA)",1.231,52706,,108.66,
2021,Canada,2021A000011124,Joliette (Medium population centre),1.232,49246,,39.03,
2021,Canada,2021A000011124,Rural area,1.233,3460,,69.63,
2021,Canada,2021A000011124,"Kamloops, British Columbia (CMA)",1.234,114142,,5654.08,
2021,Canada,2021A000011124,Kamloops (Medium population centre),1.235,92442,,74.35,
2021,Canada,2021A000011124,Chase (Small population centre),1.236,2377,,2.33,
2021,Canada,2021A000011124,Logan Lake (Small population centre),1.237,1356,,0.94,
2021,Canada,2021A000011124,Rayleigh (Small population centre),1.238,1933,,2.06,
2021,Canada,2021A000011124,Rural area,1.239,16034,,5574.4,
2021,Canada,2021A000011124,"Kawartha Lakes, Ontario (CA)",1.24,79247,,3033.66,
2021,Canada,2021A000011124,Bobcaygeon (Small population centre),1.241,3576,,5.15,
2021,Canada,2021A000011124,Fenelon Falls (Small population centre),1.242,2490,,3.98,
2021,Canada,2021A000011124,Lindsay (Small population centre),1.243,22367,,15.57,
2021,Canada,2021A000011124,Omemee (Small population centre),1.244,1060,,2.12,
2021,Canada,2021A000011124,Rural area,1.245,49754,,3006.84,
2021,Canada,2021A000011124,"Kelowna, British Columbia (CMA)",1.246,222162,,2902.45,
2021,Canada,2021A000011124,Kelowna (Large urban population centre),1.247,181380,,168.92,
2021,Canada,2021A000011124,Duck Lake (Small population centre),1.248,12725,,24.93,
2021,Canada,2021A000011124,Peachland (Small population centre),1.249,5006,,9.83,
2021,Canada,2021A000011124,Rural area,1.25,23051,,2698.78,
2021,Canada,2021A000011124,"Kenora, Ontario (CA)",1.251,14967,,211.65,
2021,Canada,2021A000011124,Kenora (Small population centre),1.252,10974,,15.25,
2021,Canada,2021A000011124,Rural area,1.253,3993,,196.4,
2021,Canada,2021A000011124,"Kentville, Nova Scotia (CA)",1.254,26929,,607.05,
2021,Canada,2021A000011124,Centreville (Small population centre),1.255,1159,,2.36,
2021,Canada,2021A000011124,Kentville (Small population centre),1.256,14905,,27.98,
2021,Canada,2021A000011124,Port Williams (Small population centre),1.257,1030,,1.92,
2021,Canada,2021A000011124,Rural area,1.258,9835,,574.79,
2021,Canada,2021A000011124,"Kingston, Ontario (CMA)",1.259,172546,,1919.17,
2021,Canada,2021A000011124,Kingston (Large urban population centre),1.26,127943,,83.43,
2021,Canada,2021A000011124,Bath (Small population centre),1.261,1825,,3.87,
2021,Canada,2021A000011124,Rural area,1.262,42778,,1831.87,
2021,Canada,2021A000011124,"Kitchener - Cambridge - Waterloo, Ontario (CMA)",1.263,575847,,1092.33,
2021,Canada,2021A000011124,Kitchener (Large urban population centre),1.264,522888,,296.45,
2021,Canada,2021A000011124,Ayr (Small population centre),1.265,5383,,5.76,
2021,Canada,2021A000011124,Elmira (Small population centre),1.266,10790,,8.15,
2021,Canada,2021A000011124,New Dundee (Small population centre),1.267,1174,,1.53,
2021,Canada,2021A000011124,New Hamburg (Small population centre),1.268,14379,,15.75,
2021,Canada,2021A000011124,St. Jacobs (Small population centre),1.269,1959,,2.81,
2021,Canada,2021A000011124,Rural area,1.27,19274,,761.87,
2021,Canada,2021A000011124,"Lachute, Quebec (CA)",1.271,14100,,108.66,
2021,Canada,2021A000011124,Lachute (Small population centre),1.272,11221,,9.59,
2021,Canada,2021A000011124,Rural area,1.273,2879,,99.06,
2021,Canada,2021A000011124,"Lacombe, Alberta (CA)",1.274,13396,,20.59,
2021,Canada,2021A000011124,Lacombe (Small population centre),1.275,12835,,11.87,
2021,Canada,2021A000011124,Rural area,1.276,561,,8.71,
2021,Canada,2021A000011124,"Ladysmith, British Columbia (CA)",1.277,15501,,412.01,
2021,Canada,2021A000011124,Ladysmith (Small population centre),1.278,11194,,13.85,
2021,Canada,2021A000011124,Rural area,1.279,4307,,398.16,
2021,Canada,2021A000011124,"Lethbridge, Alberta (CMA)",1.28,123847,,2958.96,
2021,Canada,2021A000011124,Lethbridge (Medium population centre),1.281,92563,,64,
2021,Canada,2021A000011124,Coaldale (Small population centre),1.282,8592,,5.84,
2021,Canada,2021A000011124,Coalhurst (Small population centre),1.283,2818,,1.76,
2021,Canada,2021A000011124,Nobleford (Small population centre),1.284,1438,,0.98,
2021,Canada,2021A000011124,Picture Butte (Small population centre),1.285,1808,,1.95,
2021,Canada,2021A000011124,Rural area,1.286,16628,,2884.42,
2021,Canada,2021A000011124,"Lloydminster, Saskatchewan/Alberta (CA)",1.287,36508,,1984.24,
2021,Canada,2021A000011124,Lloydminster (Medium population centre),1.288,31582,,24.43,
2021,Canada,2021A000011124,Rural area,1.289,4926,,1959.81,
2021,Canada,2021A000011124,"London, Ontario (CMA)",1.29,543551,,2661.48,
2021,Canada,2021A000011124,London (Large urban population centre),1.291,423369,,244.97,
2021,Canada,2021A000011124,St. Thomas (Medium population centre),1.292,45732,,28.1,
2021,Canada,2021A000011124,Belmont (Small population centre),1.293,1275,,0.99,
2021,Canada,2021A000011124,Dorchester (Small population centre),1.294,4355,,5.81,
2021,Canada,2021A000011124,Ilderton (Small population centre),1.295,2250,,1.19,
2021,Canada,2021A000011124,Mount Brydges (Small population centre),1.296,2656,,5.5,
2021,Canada,2021A000011124,Port Stanley (Small population centre),1.297,3008,,3.78,
2021,Canada,2021A000011124,Strathroy (Small population centre),1.298,16056,,15.3,
2021,Canada,2021A000011124,Rural area,1.299,44850,,2355.84,
2021,Canada,2021A000011124,"Matane, Quebec (CA)",1.3,18474,,865.87,
2021,Canada,2021A000011124,Matane (Small population centre),1.301,10371,,10.16,
2021,Canada,2021A000011124,Rural area,1.302,8103,,855.71,
2021,Canada,2021A000011124,"Medicine Hat, Alberta (CA)",1.303,76376,,13106.11,
2021,Canada,2021A000011124,Medicine Hat (Medium population centre),1.304,63382,,53.2,
2021,Canada,2021A000011124,Redcliff (Small population centre),1.305,5385,,7.39,
2021,Canada,2021A000011124,Rural area,1.306,7609,,13045.52,
2021,Canada,2021A000011124,"Midland, Ontario (CA)",1.307,27894,,60.75,
2021,Canada,2021A000011124,Midland (Small population centre),1.308,26246,,27.41,
2021,Canada,2021A000011124,Rural area,1.309,1648,,33.34,
2021,Canada,2021A000011124,"Miramichi, New Brunswick (CA)",1.31,27593,,7564.06,
2021,Canada,2021A000011124,Chatham - Douglastown (Small population centre),1.311,11594,,27.78,
2021,Canada,2021A000011124,Rural area,1.312,15999,,7536.28,
2021,Canada,2021A000011124,"Moncton, New Brunswick (CMA)",1.313,157717,,2562.47,
2021,Canada,2021A000011124,Moncton (Large urban population centre),1.314,119785,,110.73,
2021,Canada,2021A000011124,McEwen (Small population centre),1.315,1445,,0.83,
2021,Canada,2021A000011124,Salisbury (Small population centre),1.316,1546,,2.7,
2021,Canada,2021A000011124,Rural area,1.317,34941,,2448.21,
2021,Canada,2021A000011124,"Montréal, Quebec (CMA)",1.318,4291732,,4670.1,
2021,Canada,2021A000011124,Montréal (Large urban population centre),1.319,3675219,,1382.47,
2021,Canada,2021A000011124,Saint-Jérôme (Large urban population centre),1.32,100859,,96.97,
2021,Canada,2021A000011124,Beloeil (Medium population centre),1.321,52959,,26.5,
2021,Canada,2021A000011124,Châteauguay (Medium population centre),1.322,75891,,50.48,
2021,Canada,2021A000011124,Saint-Jean-sur-Richelieu (Medium population centre),1.323,88083,,53.8,
2021,Canada,2021A000011124,Domaine-C.-L.-C. (Small population centre),1.324,1662,,1.91,
2021,Canada,2021A000011124,Domaine-Ouellet (Small population centre),1.325,3391,,1.17,
2021,Canada,2021A000011124,Hudson (Small population centre),1.326,24245,,34.67,
2021,Canada,2021A000011124,L'Assomption (Small population centre),1.327,16443,,11.63,
2021,Canada,2021A000011124,L'Épiphanie (Small population centre),1.328,7607,,10.1,
2021,Canada,2021A000011124,Lac-Lapierre (Small population centre),1.329,2533,,2.6,
2021,Canada,2021A000011124,Laurentides (Small population centre),1.33,15768,,12.78,
2021,Canada,2021A000011124,Lavaltrie (Small population centre),1.331,11301,,7.03,
2021,Canada,2021A000011124,Les Coteaux (Small population centre),1.332,19582,,18.13,
2021,Canada,2021A000011124,Les Cèdres (Small population centre),1.333,2214,,1.79,
2021,Canada,2021A000011124,Melocheville (Small population centre),1.334,3039,,2.34,
