2021,Canada,2021A000011124,Rural area,1.669,2668,,29.21,
2021,Canada,2021A000011124,"Wetaskiwin, Alberta (CA)",1.67,12594,,18.75,
2021,Canada,2021A000011124,Wetaskiwin (Small population centre),1.671,12438,,12.11,
2021,Canada,2021A000011124,Rural area,1.672,156,,6.64,
2021,Canada,2021A000011124,"Weyburn, Saskatchewan (CA)",1.673,12247,,828.28,
2021,Canada,2021A000011124,Weyburn (Small population centre),1.674,10883,,8.51,
2021,Canada,2021A000011124,Rural area,1.675,1364,,819.77,
2021,Canada,2021A000011124,"Whitehorse, Yukon (CA)",1.676,31913,,8465.21,
2021,Canada,2021A000011124,Whitehorse (Small population centre),1.677,24513,,35.97,
2021,Canada,2021A000011124,Rural area,1.678,7400,,8429.24,
2021,Canada,2021A000011124,"Williams Lake, British Columbia (CA)",1.679,23608,,12422.14,
2021,Canada,2021A000011124,Williams Lake (Small population centre),1.68,11906,,27.69,
2021,Canada,2021A000011124,Rural area,1.681,11702,,12394.45,
2021,Canada,2021A000011124,"Windsor, Ontario (CMA)",1.682,422630,,1803.17,
2021,Canada,2021A000011124,Windsor (Large urban population centre),1.683,306519,,184.96,
2021,Canada,2021A000011124,Leamington (Medium population centre),1.684,35730,,31.77,
2021,Canada,2021A000011124,Amherstburg (Small population centre),1.685,15177,,13.7,
2021,Canada,2021A000011124,Colchester (Small population centre),1.686,2334,,3.06,
2021,Canada,2021A000011124,Essex (Small population centre),1.687,8233,,5.56,
2021,Canada,2021A000011124,Harrow (Small population centre),1.688,2562,,2.86,
2021,Canada,2021A000011124,McGregor (Small population centre),1.689,1536,,3.32,
2021,Canada,2021A000011124,Stoney Point (Small population centre),1.69,1394,,2.46,
2021,Canada,2021A000011124,Rural area,1.691,49145,,1555.5,
2021,Canada,2021A000011124,"Winkler, Manitoba (CA)",1.692,32655,,872.19,
2021,Canada,2021A000011124,Morden (Small population centre),1.693,9103,,8.53,
2021,Canada,2021A000011124,Winkler (Small population centre),1.694,15335,,19.02,
2021,Canada,2021A000011124,Rural area,1.695,8217,,844.64,
2021,Canada,2021A000011124,"Winnipeg, Manitoba (CMA)",1.696,834678,,5285.46,
2021,Canada,2021A000011124,Winnipeg (Large urban population centre),1.697,758515,,356.99,
2021,Canada,2021A000011124,Ile des Chênes (Small population centre),1.698,1572,,1.83,
2021,Canada,2021A000011124,La Salle (Small population centre),1.699,2471,,3,
2021,Canada,2021A000011124,Landmark (Small population centre),1.7,1284,,2.22,
2021,Canada,2021A000011124,Lorette (Small population centre),1.701,3230,,3.15,
2021,Canada,2021A000011124,Niverville (Small population centre),1.702,5593,,4.23,
2021,Canada,2021A000011124,Oak Bluff (Small population centre),1.703,1442,,2.52,
2021,Canada,2021A000011124,Oakbank (Small population centre),1.704,5041,,5.39,
2021,Canada,2021A000011124,St. Adolphe (Small population centre),1.705,1595,,1.74,
2021,Canada,2021A000011124,Rural area,1.706,53935,,4904.39,
2021,Canada,2021A000011124,"Wood Buffalo, Alberta (CA)",1.707,73837,,60957.21,
2021,Canada,2021A000011124,Fort McMurray (Medium population centre),1.708,68002,,52.17,
2021,Canada,2021A000011124,Rural area,1.709,5835,,60905.04,
2021,Canada,2021A000011124,"Woodstock, Ontario (CA)",1.71,46705,,56.46,
2021,Canada,2021A000011124,Woodstock (Medium population centre),1.711,46296,,34.41,
2021,Canada,2021A000011124,Rural area,1.712,409,,22.06,
2021,Canada,2021A000011124,"Yellowknife, Northwest Territories (CA)",1.713,20340,,103.37,
2021,Canada,2021A000011124,Yellowknife (Small population centre),1.714,19673,,18.11,
2021,Canada,2021A000011124,Rural area,1.715,667,,85.26,
2021,Canada,2021A000011124,"Yorkton, Saskatchewan (CA)",1.716,19859,,1623.32,
2021,Canada,2021A000011124,Yorkton (Small population centre),1.717,15969,,10.68,
2021,Canada,2021A000011124,Rural area,1.718,3890,,1612.64,
